[
 {
  "attempts": 3,
  "brief": "Bargi Diversion Project Phase - III [km. 104 to km 154] (400116) is monitored under Water Resources-MP in Madhya Pradesh. In the 2026-07 report it stands at 81.52% physical progress with cumulative expenditure of 2,270.96 crore against a revised cost of 1,399.70 crore. Cumulative expenditure ₹1,993.52 cr exceeds the revised cost ₹1,399.70 cr in 2025-12. The rule-based risk score is 100 (red).",
  "facts_hash": "92f9e3a35e1db9e75001f8d70a7b1a9ad8b819f252073508e134fa0b1c458b78",
  "generated_at": "2026-09-08T15:39:19+00:00",
  "grounded": false,
  "model": "qwen2.5:3b",
  "project_code": "400116",
  "seed": 0
 },
 {
  "attempts": 1,
  "brief": "The NORTH URIMARI EXPANSION OCP project, under the Ministry of Coal in Jharkhand, has been ongoing since 2025-12. The project's cumulative expenditure has decreased from ₹696.05 crore in December 2025 to ₹605.70 crore in April 2026, which is a critical flag as cumulative expenditure cannot decrease. There has also been a medium-level flag due to a drop in physical progress from 71.38% in April 2026 to 68.75% in May 2026. Additionally, the revised cost has dropped from ₹778.80 crore to ₹634.30 crore between May 2026 and June 2026, which is a high-level flag. Given the current expenditure and progress, the project is expected to take 316 months to complete at its current rate, leaving only 32 months until the stated completion date of March 2029. The model predicts a 1% chance of a revised completion date in the next report, and there is a significant cost overrun of 6.34 percentage points compared to similar projects. The current risk score is at 100 (red), indicating a critical situation.",
  "facts_hash": "f17f1118b191eeec4e006729f46a035707c12d826acc559584b6c874facfeb29",
  "generated_at": "2026-09-08T15:39:23+00:00",
  "grounded": true,
  "model": "qwen2.5:3b",
  "project_code": "400151",
  "seed": 0
 },
 {
  "attempts": 1,
  "brief": "The RAJRAPPA RCE OCP project, under the CCL - CIL agency in Jharkhand's coal sector, has been ongoing since 2025-12. The project's progress has fluctuated, with a notable drop from 78.25% in 2026-04 to 76.99% in 2026-05, and then to 75.61% in 2026-06. Despite these setbacks, the cumulative expenditure has remained stable at ₹488.71 crore, which is slightly below the original cost of ₹510.85 crore. However, the risk score is at a critical level of 90 (red), indicating that the project is not on track to meet its revised completion date of 2027-03. There is also a high risk flag due to a cumulative expenditure decrease from ₹489.20 crore in 2026-06 to ₹488.71 crore in 2026-07. The probability of a revised completion date being filed in the next report is only 2%, and the cost overrun is at 11.74 percentage points above comparable projects. These factors highlight the need for immediate attention and intervention to ensure the project's timely completion.",
  "facts_hash": "e10c571d05879f5ed208ea7d1b62cde1004ed52ade775a5b2631a193866d9f47",
  "generated_at": "2026-09-08T15:41:53+00:00",
  "grounded": true,
  "model": "qwen2.5:3b",
  "project_code": "400160",
  "seed": 0
 },
 {
  "attempts": 1,
  "brief": "The 2G Ethanol Biorefinery at Bathinda, a project under the supervision of Hindustan Petroleum Corporation Limited in the Oil & Gas sector of Punjab, is currently ongoing. The project's progress has been steadily improving, reaching 95.80% in the latest reports from 2026-05 and 2026-06. However, there has been a slight dip in physical progress, dropping to 94.00% in 2026-06. Despite this, the project remains on track with its revised completion date of 2026-12, which is 5 months behind the original schedule. The project has seen a significant reduction in cumulative expenditure, dropping from ₹1,293.34 crore in 2026-06 to ₹1,291.35 crore in 2026-07, a decrease of ₹2.00 crore. The risk score for this project is at 85, indicating a red alert. The probability of the revised completion date being filed in the next report is 18%, and the project is facing a cost overrun of 19.29% compared to similar projects.",
  "facts_hash": "d3daed1aa8219a435a461587d943cb2c85554d87de652da641479af5def0bc47",
  "generated_at": "2026-09-08T15:42:46+00:00",
  "grounded": true,
  "model": "qwen2.5:3b",
  "project_code": "400171",
  "seed": 0
 },
 {
  "attempts": 1,
  "brief": "The ongoing project 400232, a fly-over connection for joining down line in Brundamal, is in the state of Odisha, under the Railways sector. The project is 55% complete as of the 2026-07 report, which is a significant drop from the 67% reported in the 2026-06 report. The cumulative expenditure has also decreased from ₹237.83 crore in 2026-06 to ₹46.39 crore in 2026-07, which is concerning as a cumulative field cannot decrease. The project is facing multiple flags, including a critical flag for physical progress falling from 67% to 55%, and a critical flag for the revised cost dropping from ₹297.00 crore to ₹296.51 crore. The model predicts a 5% chance of a revised completion date being filed in the next report, and there is a 46.78 percentage point cost overrun compared to similar projects. Given the critical flags and the significant drop in progress and expenditure, immediate attention is required to address these issues and ensure the project stays on track.",
  "facts_hash": "d48c162978d84eb97da8100fbef199a5d1a2132921fd7f3625d3a8fb2dd0cbe8",
  "generated_at": "2026-09-08T15:41:19+00:00",
  "grounded": true,
  "model": "qwen2.5:3b",
  "project_code": "400232",
  "seed": 0
 },
 {
  "attempts": 1,
  "brief": "The infrastructure project 400247, covering various rail segments in West Bengal, is currently in the ongoing phase. Since 2025-12, the project has seen significant progress, with cumulative expenditure reaching 1,066.85 crore, which exceeds the revised cost of 1,000.00 crore. The revised completion date has been adjusted from 2027-02 to 2028-03, a change noted in the 2026-04 report. However, the project faces several challenges. Cumulative expenditure has surpassed the revised cost multiple times, including in 2026-04 and 2026-05, with the latest figure reaching 1,066.85 crore. Additionally, there has been a significant drop in physical progress from 76% in 2026-06 to 49% in 2026-07, which is concerning. The project also faces a critical risk due to a drop in cumulative expenditure from 1,066.85 crore in 2026-06 to 925.70 crore in 2026-07, a decrease that is not acceptable. Furthermore, the project has a high risk due to a significant drop in physical progress, and a critical risk due to the project not meeting the revised completion date of 2028-03. Given these factors, the risk score is at 100, indicating a red alert. The probability of the revised completion date being met in the next report is only 5%, and the project is 74.86 percentage points over budget compared to similar projects.",
  "facts_hash": "66134828159f007698d5701409d3ca340eaa04eb52c7febfe96b469de6a8288c",
  "generated_at": "2026-09-08T15:39:28+00:00",
  "grounded": true,
  "model": "qwen2.5:3b",
  "project_code": "400247",
  "seed": 0
 },
 {
  "attempts": 1,
  "brief": "The Tindivanam-Nagari project, spanning 179.2 kilometers and managed by CAOC/SR SR, is currently in the ongoing phase. Since December 2025, the project has seen a gradual decline in progress, dropping from 19.00% in December 2025 to 16.50% in April 2026. Despite this, the cumulative expenditure has increased from 1,176.55 crore in December 2025 to 1,259.70 crore in April 2026. However, the physical progress has also decreased, from 16.85% in June 2026 to 16.50% in July 2026. Given the current trends, the project's revised completion date of March 2028 appears to be at risk, as the cumulative expenditure has not increased and the physical progress has fallen. Additionally, there are critical flags indicating a significant drop in progress and expenditure, and a risk score of 95 (red) from the model, suggesting a high likelihood of cost overruns. The probability of the revised completion date being met in the next report is only 2%, and the project is facing a significant cost overrun of 135.83 percentage points compared to similar projects.",
  "facts_hash": "1f8fbb52869b7ef4b94b18e674cc1650c3057e34937f8e17e19ba9a6e217b7df",
  "generated_at": "2026-09-08T15:41:22+00:00",
  "grounded": true,
  "model": "qwen2.5:3b",
  "project_code": "400275",
  "seed": 0
 },
 {
  "attempts": 1,
  "brief": "The Kirandul-Jagdalpur railway project, a 150 km stretch under the jurisdiction of CAO/C/ECOR ECoR mor in Chhattisgarh's Railways sector, has been progressing steadily since 2025-12. The project's revised completion date has been adjusted from 2025-12 to 2027-04, as reported in the latest reports. Despite this delay, the project has maintained a high level of progress, with cumulative expenditures reaching 1,691.27 crore in 2026-06. However, there are several flags indicating potential issues. Physical progress has fallen from 97.6% in 2026-05 to 96.17% in 2026-06, and the cumulative expenditure has decreased from 1,691.27 crore in 2026-06 to 1,369.01 crore in 2026-07, which is a significant drop. Additionally, physical progress has dropped from 96.17% in 2026-06 to 89% in 2026-07. Given these flags, the risk score is at 100 (red), indicating a critical situation. The probability of the revised completion date being filed in the next report is only 3%, and the project is facing a cost overrun of 21.91 percentage points compared to similar projects. These factors highlight the need for immediate attention and intervention to ensure the project's timely completion and adherence to budget constraints.",
  "facts_hash": "e597a596dcb1afee59757a76999352f3c5ef0507cefa206df311a938dd0256fd",
  "generated_at": "2026-09-08T15:39:32+00:00",
  "grounded": true,
  "model": "qwen2.5:3b",
  "project_code": "400291",
  "seed": 0
 },
 {
  "attempts": 1,